{
  "schema_version": 1,
  "sprint": "sprint-04",
  "timezone": "America/Sao_Paulo",
  "starts_at": null,
  "ends_at": null,
  "repositories": [
    {
      "repository": "tedeuxx/tadeumendonca-skills",
      "milestone_number": 6
    }
  ],
  "counting_units": [
    {
      "issue": "tedeuxx/tadeumendonca-skills#508",
      "planned_points": 8,
      "work_type": "loop",
      "parent": null,
      "estimate_provenance": {
        "agents-lead": 5,
        "quality-assurance": 8,
        "median": 6.5,
        "recorded": 8,
        "owner_commitment": "confirmed in sprint-04 planning; no ratified rule rounds a median of two, so the orchestrator recorded the next Fibonacci value up"
      },
      "source_revision": "1afb64578a505fe1e62d911b399fe387c33b0b98"
    },
    {
      "issue": "tedeuxx/tadeumendonca-skills#509",
      "planned_points": 5,
      "work_type": "loop",
      "parent": null,
      "estimate_provenance": {
        "agents-lead": 5,
        "quality-assurance": 5,
        "median": 5,
        "owner_commitment": "confirmed in sprint-04 planning"
      },
      "source_revision": "1afb64578a505fe1e62d911b399fe387c33b0b98"
    }
  ]
}
